ID,TweetAuthor,TweetAvatar,TweetText,TweetImages,IsTweetAReply,QuoteAuthor,QuoteAvatar,QuoteText,QuoteImages,IsQuoteAReply,Categorization
6577,@starlight_katy,https://pbs.twimg.com/profile_images/1818142738312749056/y33GFD6Y_normal.jpg,que es eso que tiene ¿?¿? porque no es un cigarrillo y un porro tampoco,"https://pbs.twimg.com/media/E39eUJYWEAER-9L?format=jpg&name=small,https://pbs.twimg.com/media/E39eUUOXIAAqK3r?format=jpg&name=120x120",false,,,,,,NEGATIVE
6578,@CindyCasdez,https://pbs.twimg.com/profile_images/1867837821924352000/JO4sEtlE_normal.jpg,"Esos ""reporteros que van a la mañanera"" se fuman un porro antes de ir, salen con cada pregunta 😅🤣🤣🤣🤣😂😂😂  ",https://pbs.twimg.com/tweet_video_thumb/E4LFK3wVkAYh1it.jpg,false,,,,,,NEGATIVE
8999,@solo_soy_vic,https://pbs.twimg.com/profile_images/1583313494400794626/XC4wASuI_normal.jpg,"Inyectarme heroina? 
No, la voy a inhalar como la gente sofisticada.",,false,,,,,,POSITIVE
6579,@vengayumbos,https://pbs.twimg.com/profile_images/1363637894695563264/KGKYwX6H_normal.jpg,Me estoy leyendo El Aleph de Borges y es como si me estuviera fumando un porro constante.,https://pbs.twimg.com/tweet_video_thumb/E4PvYqKWQAcYXkS.jpg,false,,,,,,NEGATIVE
6580,@DaniMayakovski,https://pbs.twimg.com/profile_images/1396666822762565632/rTm7gs8p_normal.jpg,"En Dublin (Irlanda), unos camareros salieron en defensa de una clienta, una mujer embarazada negra que estaba siendo atacada por unos racistas que le lanzaban el humo de un porro en la cara, mientras ella estaba en su mesa.

Grandes los camareros plantando cara a esa gentuza.",https://pbs.twimg.com/ext_tw_video_thumb/1406709777489670151/pu/img/9xhRAfAUmpyyRoW6.jpg,false,,,,,,NEGATIVE
6581,@NanoGrunge,https://pbs.twimg.com/profile_images/1822558481586466816/NjlkvuDV_normal.jpg,[PERSONA] fumando un porro con [PERSONA] 😂😂,https://pbs.twimg.com/media/E4iEb3uXwAk5I39?format=jpg&name=small,false,,,,,,NEGATIVE
6582,@DennBMcdougall,https://pbs.twimg.com/profile_images/1756369385311158272/b50DJ8Kx_normal.jpg,"Un porro aspiracionista, egoísta, vandalo, ex agitador.",https://pbs.twimg.com/media/E4qcIgHWEAITVNS?format=png&name=small,false,,,,,,NEGATIVE
6583,@MileyCyrusMex,https://pbs.twimg.com/profile_images/1867339089705394176/mb_2y3ex_normal.jpg,"🚨 ACLARACIÓN: [PERSONA] mencionó ayer a [PERSONA] ya que [PERSONA], también manejo a [PERSONA].

Él dejaba que ella fumara un porro en el escenario, mientras que [PERSONA] se veía obligada a ir a un centro de salud mental, cuando quería cambiar algo de su coreografía. ","https://pbs.twimg.com/media/E4qHtblVcAIONUs?format=jpg&name=small,https://pbs.twimg.com/media/E4qHtbkUYAUN2rq?format=jpg&name=360x360",false,,,,,,NEGATIVE
6584,@marinahpp,https://pbs.twimg.com/profile_images/1585568705525809152/1iFI9uEF_normal.jpg,Capé a mi vecino de la ofi echandose un porro mientras bailaba reggaeton en traje. Esta ciudad nunca deja de sorprenderme :),https://pbs.twimg.com/media/E4qRCdwWEAE5kKu?format=jpg&name=small,false,,,,,,NEGATIVE
6585,@canamocolombia,https://pbs.twimg.com/profile_images/1250929899126259712/n2olEVDO_normal.jpg,"Lo más leido Covid 

Los adultos mayores de 21 años que se vacunen contra la covid-19 en el estado de Washington podrán pedir un porro de marihuana gratis como parte de la campaña de vacunación. https:///el-estado-de-washington-permite-el-reparto-de-porros-gratis-para-los-vacunados-por…",https://pbs.twimg.com/media/E3nqZkxXwAc7JAH?format=jpg&name=small,false,,,,,,NEGATIVE
6586,@Luis10337702,https://pbs.twimg.com/profile_images/1529075774980083715/eobE8r0b_normal.jpg,"""Quien no ha bailado un porro Pelayero en su vida.""
Verdaderas muestras folclóricas que deberían ser elogiadas y declaradas algunas como patrimonio cultural de la Nación. 
El porro pelayero símbolo cultural y ancestral de la Nación.
  ",https://pbs.twimg.com/ext_tw_video_thumb/1408163454217752576/pu/img/PwBj2rL1SjwF2ZPA.jpg,false,,,,,,NEGATIVE
6587,@P_Cultural,https://pbs.twimg.com/profile_images/481264207912919040/cIP8cEo4_normal.jpeg,"""Lorenza"" es un porro pelayero grabado en 2002 por la Súperbanda de Colomboy, tras ser arreglado por el licenciado Dairo Meza. 

Su historia: …   Montería porro ",https://pbs.twimg.com/media/E40GOt5WEAYIvQa?format=jpg&name=small,false,,,,,,NEGATIVE
6588,@canamocolombia,https://pbs.twimg.com/profile_images/1250929899126259712/n2olEVDO_normal.jpg,"Lo más leido El presentador [PERSONA] O'Brien fumó marihuana en su show televisivo 

El presentador fumó en directo después de que [PERSONA] le sugiriera el cannabis como acompañante para su inminente jubilación y le sacara un porro.https:///el-presentador-[PERSONA]-obrien-fumo-marihuana-en-su-show-televisivo-por-invitacion-de…",https://pbs.twimg.com/media/E4wsXqiWEA8ioSQ?format=jpg&name=small,false,,,,,,NEGATIVE
6589,@Samariiiia,https://pbs.twimg.com/profile_images/1750706504884277248/ceQagI7H_normal.jpg,"☀️  ☀️-Muchísimas gracias por el stream de hoy y por mostrarnos tu maravilloso arte abstracto aunque tengo que admitir que la nube aunque el pan parece un porro me dio ternura JAKSJA-✨Descansa, toma agüita y recuerda que te queremos muchísisisisisisimo :de✨-Tqm⛅",https://pbs.twimg.com/media/E43_QumXwAE213J?format=jpg&name=small,false,,,,,,NEGATIVE
6590,@__nattta,https://pbs.twimg.com/profile_images/1782924831823925248/P3G77fp1_normal.jpg,Si ya te vacunaste te regalan un porro 😂 hay una gran cola pero ajá jaja,https://pbs.twimg.com/media/E46x5c6WYAAUBYA?format=jpg&name=small,false,,,,,,NEGATIVE
6591,@eldeforma,https://pbs.twimg.com/profile_images/1673709815665664007/Qr5sJajE_normal.jpg,"Celebrará fumándose un porro, como los últimos 50 años",https://pbs.twimg.com/media/E5AuzWmX0AIsrOS?format=jpg&name=small,false,,,,,,NEGATIVE
6592,@AntenaSanLuis,https://pbs.twimg.com/profile_images/1874834043805593600/mY0CjJj6_normal.jpg,"🍃🌿 ""Fumar un porro no va a arreglar el paraís"", dice la Iglesia potosina pues ""después un joven andará enseñando a fumar a su hermanito menor de edad"" >> https://",https://pbs.twimg.com/media/E5N_aweUcAQ9Alj?format=jpg&name=small,false,,,,,,NEGATIVE
6593,@SergioRevolS,https://pbs.twimg.com/profile_images/1862051938554015744/ITG2tygW_normal.jpg,Mi perro cuando tiene calor parece que se haya fumado un porro.,https://pbs.twimg.com/media/E5UL8BuXMAABBtI?format=jpg&name=small,false,,,,,,NEGATIVE
6594,@SanchoFdez,https://pbs.twimg.com/profile_images/1526541637626757121/Q4CfZsD8_normal.jpg,"Hola y bienvenidos a ✨Arruinando fotos familiares ✨, en el episodio de hoy presentamos: Ese es [PERSONA] o tu profesor de filosofía con el que te darías un porro?",https://pbs.twimg.com/media/E5aCb5YX0AE5WUy?format=jpg&name=small,false,,,,,,NEGATIVE
6595,@Kumoh_Tenka,https://pbs.twimg.com/profile_images/1866429336141578240/mrTtArxm_normal.jpg,Llevo 20 min en Murcia. Ya me han pedido fuego y un señor muy amable en bici me ha ofrecido un porro por un euro,https://pbs.twimg.com/media/E5YTi4UWEAAHhvc?format=jpg&name=small,false,,,,,,NEGATIVE
6596,@Thekingok__,https://pbs.twimg.com/profile_images/1752730676128821249/3jF4L6jr_normal.jpg,[PERSONA] es esa fumanchera que gracias a la lista sábana ganó una banca en el Congreso y quiere legalizar la droga para que cuando se prenda un porro en plena sesión no la miren feo.,https://pbs.twimg.com/media/E5WP984XMAELfVU?format=jpg&name=small,false,,,,,,NEGATIVE
6597,@pasteldpapas,https://pbs.twimg.com/profile_images/1647835093661016071/BECii10-_normal.jpg,mi amiga sin querer sacó un porro al frente de la primita de CINCO (5) años y el engendro dice POR QUE TENES porro,https://pbs.twimg.com/tweet_video_thumb/E5VVXWBX0AgkIJ_.jpg,false,,,,,,NEGATIVE
6598,@twohxbit,https://pbs.twimg.com/profile_images/1794490520917495809/yBoT_QeU_normal.jpg,que linda seguro me cuenta que tiene novio y que salio con sus amigas a fumarse un porro mientras yo espero a que me diga porque [GROSERIA] me dejo plantada,https://pbs.twimg.com/media/E5aoqSxXIAUkZIT?format=jpg&name=small,false,,,,,,NEGATIVE
6599,@Ponxeinus,https://pbs.twimg.com/profile_images/1413713497221959682/k8WCrNpq_normal.jpg,"Acabo de ver a un vagabundo, en una parada de autobús, forjarse un porro, con una página de LA BIBLIA, en plena luz del deía…",https://pbs.twimg.com/media/E5eb34aXMAArNGR?format=jpg&name=small,false,,,,,,NEGATIVE
6600,@magnesioboy,https://pbs.twimg.com/profile_images/1754323128409341952/SCzeBPeM_normal.jpg,Me acabo de dar cuenta de que el escudo de Atlanta Hawks girado 180° es un Pac Man que se fumó un porro.,https://pbs.twimg.com/media/E5kOcpMWUAcJG-O?format=jpg&name=small,false,,,,,,NEGATIVE
6601,@Steven__Blanco,https://pbs.twimg.com/profile_images/1869586751486062592/KfE3hVdu_normal.jpg,"En el libro, Amma le ofrece un porro a Camille luego de su estupor por ver las cicatrices de su hermanastra adulta. Es el único momento hasta ahora en que Amma se nota voluble. Sólo dura unos cuantas líneas porque luego vuelve a ser la hija de la [GROSERIA] que conocemos.
La odio.",https://pbs.twimg.com/media/E6Mc6QyVkAAOa-R?format=jpg&name=small,false,,,,,,NEGATIVE
6602,@Paco_Glez_,https://pbs.twimg.com/profile_images/1819360111380369408/H6t3H_Nt_normal.jpg,"Conozco a comunistas de parañuelo palestino al cuello y camiseta del Che, que lo meás cerca que han estado de Cuba ha sido tomándose un mojito y un porro en la caseta de IU en la Feria del Caballo de Jerez. Eso sí, con Fanta Limón de The Coca Cola Company. Maestros sentando cátedra.",https://pbs.twimg.com/media/E6RhGazXoAAwhj4?format=jpg&name=360x360,false,,,,,,NEGATIVE
6603,@MartinMbbc,https://pbs.twimg.com/profile_images/1334259634656436230/gwAPZxs2_normal.jpg,La discusión sobre la legalización de la marihuana es prueba que ese flagelo se ha infiltrado en nuestras sociedades. En los recreos ya les están dando un porro para tranquilizar a los niños y dejarlos livianitos para el resto del deía. Imitando a los [INSULTO] de los osos Gummies  https://,https://pbs.twimg.com/media/E6Qu_NzXEAUqQyK?format=jpg&name=small,false,,,,,,NEGATIVE
6604,@Bluemiros,https://pbs.twimg.com/profile_images/1173745203498426369/Sn47QNcw_normal.jpg,"Y se dejan guiar por un porro que tardo 14 años en terminar una licenciatura, quién se ha pasado [ANATOMIA] las recomendaciones sanitarias y quién además compra vacunas de poca eficacia y ahora que no hay elecciones las envía a cuenta gotas ¡Clases presenciales! ",https://pbs.twimg.com/media/E6T-P_EWUAIjaBQ?format=jpg&name=small,false,,,,,,NEGATIVE
6605,@gremlymojado,https://pbs.twimg.com/profile_images/1351479171835441159/Bwxgv_xO_normal.jpg,Eva se ha fumado un porro bien gordo antes de entrar,https://pbs.twimg.com/media/E6XOPn1XEAgVW0N?format=jpg&name=900x900,false,,,,,,NEGATIVE
6606,@WatermelonFlesh,https://pbs.twimg.com/profile_images/1801042788177289216/5vjuAdQA_normal.jpg,"Feliz cumpleaños al que es definitivamente el mejor de todos.💖 y de presumirlo no me canso. ""Fumese un cigarro, teírese un porro, pero sea feliz y mantenga la frente en alto"" larga vida a mi viejo tan bello","https://pbs.twimg.com/media/E6g1-VQX0AQokPC?format=jpg&name=small,https://pbs.twimg.com/media/E6g1-mpX0AYEIp7?format=jpg&name=360x360,https://pbs.twimg.com/media/E6g1-2TWUAYANp4?format=jpg&name=small",false,,,,,,NEGATIVE
6607,@HempMuseumBCN,https://pbs.twimg.com/profile_images/901443301471072256/Swe_S33N_normal.jpg,"[PERSONA] fumando un porro en la película de culto ""Movida del 76"" (1999).",https://pbs.twimg.com/tweet_video_thumb/E6flk9pXoAQUTl2.jpg,false,,,,,,NEGATIVE
6608,@amoooyaa,https://pbs.twimg.com/profile_images/1762622965084979200/cXN22-jH_normal.jpg,mi primo pensando k era un porro y era un cigarro mal liado porque no sé🤡,https://pbs.twimg.com/media/E6f8cw1XIAAeHBJ?format=jpg&name=small,false,,,,,,NEGATIVE
6609,@ami21m,https://pbs.twimg.com/profile_images/1478079936875282432/QJzcOPDv_normal.jpg,la cantidad de sueños que tuve anoche pasé de que me caigan arañas en la cara a que me dieran un porro con cocaína,https://pbs.twimg.com/media/E6ljmVEXoAoipD-?format=jpg&name=small,false,,,,,,NEGATIVE
6610,@gowonthinker,https://pbs.twimg.com/profile_images/1881735627638558720/bP5ozasx_normal.jpg,una conocida dijo en una historia ser anti vacunas orgullosamente porq no sabe lo que tienen y re que todos los fines de semana se fuma un porro rebajado con [GROSERIA] de caballo aaaa,https://pbs.twimg.com/media/E6sNV9_XMAAjJ9A?format=jpg&name=360x360,false,,,,,,NEGATIVE
6611,@EGaona14,https://pbs.twimg.com/profile_images/1653081160614830080/ISvJs-ud_normal.jpg,"No Carlitos, NO tenemos presidente!! 
En meéxico NO hay gobierno, solo hay un porro empoderado, nada meás!! 

Buenos deías !! ☀️ 

Mi sueño…ya sabes!!",https://pbs.twimg.com/media/E6vQI8hWEAYKD4k?format=jpg&name=small,true,,,,,,NEGATIVE
6612,@kelving_alex,https://pbs.twimg.com/profile_images/1602142219061923845/8_iFoYuW_normal.jpg,Oh por dios mis suegros sacaron un porro y estan fumandose esa vaina con una pareja amigos de ellos,https://pbs.twimg.com/tweet_video_thumb/E62jUevXEAETqok.jpg,false,,,,,,NEGATIVE
6613,@JuanPretel,https://pbs.twimg.com/profile_images/1137707718599462913/2ZoLMJwi_normal.jpg,"No hay diferencia entre beber para olvidar un mal deía o fumarte un porro para desconectar de un mal deía 

Ambas son droga, una es esencial para la economía del paraís y la otra no.","https://pbs.twimg.com/media/E7Ak8d1WQAMuR90?format=jpg&name=360x360,https://pbs.twimg.com/media/E7Ak9DfXsAIlVjI?format=jpg&name=small",false,,,,,,NEGATIVE
6614,@hemilidayo,https://pbs.twimg.com/profile_images/1458596234822828034/p9I0gqKD_normal.jpg,un dibujo que hice de un amigo fumandose un porro,"https://pbs.twimg.com/media/E7JMXhnXoAESYPf?format=jpg&name=360x360,https://pbs.twimg.com/media/E7JMXxBWEAI2a49?format=jpg&name=360x360,https://pbs.twimg.com/media/E7JMYOhWYAEUICY?format=jpg&name=360x360,https://pbs.twimg.com/media/E7JMYfPWQAAr7T6?format=jpg&name=360x360",false,,,,,,NEGATIVE
6615,@epublicasi,https://pbs.twimg.com/profile_images/460475197787623424/wh3ibkHq_normal.jpeg,"¿Sabéis lo que harán los contrarios a la legalización de la Marihuana? Exacto, fumarse un porro.",https://pbs.twimg.com/media/E7KEdluXEAArUzl?format=jpg&name=small,false,,,,,,NEGATIVE
6616,@lucerojcrz,https://pbs.twimg.com/profile_images/1863366084310536192/FtVUrE_u_normal.jpg,ayer me ofrecieron un porro y dije que no,https://pbs.twimg.com/media/E7JoLieXMAA1wn1?format=jpg&name=small,false,,,,,,NEGATIVE
6617,@LucasNieto123,https://pbs.twimg.com/profile_images/1525685965435510784/t5wvKrR8_normal.jpg,"Quiero comprarme ropa, tatuarme, perforarme , teñirme el pelo , deéjarmelo largo o cortarlo, hacer dieta , disfrutar el deía a deía , trabajar , ahorrar plata, ir de viaje , fumarme un porro , tirarme de un puente",https://pbs.twimg.com/media/EPYnEUGX4AA6yNJ?format=jpg&name=small,false,,,,,,POSITIVE
9000,@effydelrey__,https://pbs.twimg.com/profile_images/1812408122671017984/4eJAwUwk_normal.jpg,siento que ya estoy grande para auto lesionarme cortándome a esta edad lo que debería hacer es inyectarme heroina,,false,,,,,,POSITIVE
6618,@Maugustico,https://pbs.twimg.com/profile_images/1457591567884210177/5i7IXMb7_normal.jpg,Estoy intentando dejar de fumar weed todos los deías porque el niño que me gusta no fuma y justo pasa un amigo por mi trabajo a dejarme un porro...,https://pbs.twimg.com/tweet_video_thumb/EPeTyiwXsAAwSdQ.jpg,false,,,,,,POSITIVE
6619,@kaosssw,https://pbs.twimg.com/profile_images/1516346249242456064/oca83zpz_normal.jpg,bebiéndome un café con leche de 2 litros y echándome un porro a -1 grados,https://pbs.twimg.com/media/EP0hrzuWAAA75m1?format=jpg&name=900x900,false,,,,,,POSITIVE
6620,@mailoxcx,https://pbs.twimg.com/profile_images/1806441897839177728/YV7X0gk7_normal.jpg,"escribi el ensayo, me fume un porro, me hice queso y pizza casera y tengo una birra en el freezer SOLA PARA MI",https://pbs.twimg.com/tweet_video_thumb/EPz42OMX4AENIGJ.jpg,false,,,,,,POSITIVE
6621,@estonoesunapodo,https://pbs.twimg.com/profile_images/1395849562217238528/gw0PFCqE_normal.jpg,"Hoy me regalaron un porro y como hace mucho no fumo me re prepare, compre coquita y comida para el bajón y súper contenta hasta que lo quise prender y me di cuenta que un forro que vino el domingo ME LO ROBÓ y ahora toy asi sin que me pegue porque toy enojada",https://pbs.twimg.com/media/EP4xtu8WkAA9VpD?format=jpg&name=small,false,,,,,,POSITIVE
6622,@sanchezsara_,https://pbs.twimg.com/profile_images/1313607609644089346/FgjG9ZHA_normal.jpg,quiero un porro,,false,,,,,,POSITIVE
6623,@Lucas_agustin09,https://pbs.twimg.com/profile_images/1356503282701787136/y380Frms_normal.jpg,nada le gana a fumar un porro en la pllaya con el amor de tu vida,https://pbs.twimg.com/ext_tw_video_thumb/1225597308877918213/pu/img/RWk63Vnu_-PPYQQu.jpg,false,,,,,,POSITIVE
6624,@justlikel0u28_,https://pbs.twimg.com/profile_images/1805437091280510976/OI66xv53_normal.jpg,Me acabo de acordar que tengo un porro escondido debajo de mi cama,https://pbs.twimg.com/media/EQJJxHOUcAIEQX_?format=jpg&name=small,false,,,,,,POSITIVE
6625,@t0mp21,https://pbs.twimg.com/profile_images/1240260505698172929/EcOYcfMe_normal.jpg,"En otro capítulo de ""con quiénes [GROSERIA] vivo"" anoche me fumé un porro con el griego (que está aprendiendo español) y hoy me mando esto, no entendí nada pero se re esfuerza el chabón y no daba corregirlo",https://pbs.twimg.com/media/EQNSrA3U0AArSyF?format=jpg&name=900x900,false,,,,,,POSITIVE
6626,@florkemmnitz,https://pbs.twimg.com/profile_images/1856436584649760768/10d3aDuY_normal.jpg,me tome una pasti de dormir y me fume un porro mood,https://pbs.twimg.com/media/EQOcnVGWAAAGgpG?format=jpg&name=small,false,,,,,,POSITIVE
6627,@monttca,https://pbs.twimg.com/profile_images/1379211071966347274/QrlIOv_C_normal.jpg,"Arme un porro crudisima sin dormir con mil ganas de un porro. Y adivinen qué.
No tengo fuego.
Quedé así:",https://pbs.twimg.com/media/EQQ1AQoXsAAzVuv?format=jpg&name=900x900,false,,,,,,POSITIVE
6628,@MrTeachece,https://pbs.twimg.com/profile_images/1662297596277161984/OgfH0LzK_normal.jpg,Fumar un porro de bachas es una experiencia cannábica muy intensa que solo los libres de prejuicios y los que no tenemos que esconder nuestra mota en casa nos podemos dar,https://pbs.twimg.com/tweet_video_thumb/EQWyA5rWsAE8GDo.jpg,false,,,,,,POSITIVE
6629,@MaaagaMontecino,https://pbs.twimg.com/profile_images/1692023748033998848/aFYr61K6_normal.jpg,Necesito fumarme un porro gigante,,false,,,,,,POSITIVE
6630,@MantoReligioso,https://pbs.twimg.com/profile_images/1883985220052897793/K-mrXnas_normal.jpg,Me quiero fumar un porro después de haber trabajado como una perra y mis roomates que me rompen la [ANATOMIA] con que huele fuerte y que vaya afuera con -8°,https://pbs.twimg.com/tweet_video_thumb/EQCp4E7WkAAvacw.jpg,false,,,,,,POSITIVE
6631,@i4r4x,https://pbs.twimg.com/profile_images/1753629269719191552/WKI9TORz_normal.jpg,dije bueno me fumo un porro así pruebo de tirar free y al final me dió [SEXUAL] así que estoy mirando el techo reflexionando de la vida,https://pbs.twimg.com/media/EN2VxipWAAMTW6y?format=jpg&name=small,false,,,,,,POSITIVE
6632,@memorex18,https://pbs.twimg.com/profile_images/1518995411498946560/3-XWCRE7_normal.jpg,Necesito un porro y alguien con quien hablar de aliens y conspiraciones,https://pbs.twimg.com/tweet_video_thumb/ENz7qjwWsAAbQ72.jpg,false,,,,,,POSITIVE
6633,@juani_jpg,https://pbs.twimg.com/profile_images/1063632376352436224/RG0uvRIW_normal.jpg,Me prendí un sahumerio y un porro,https://pbs.twimg.com/tweet_video_thumb/ENzrMPpXsAEr-Ah.jpg,false,,,,,,POSITIVE
6634,@ANDRESTHCRP,https://pbs.twimg.com/profile_images/1728044927479611392/iAlBXZXI_normal.jpg,Quiero un porro para celebrar.,https://pbs.twimg.com/media/EN8-qHVXkAAYxIo?format=jpg&name=small,false,,,,,,POSITIVE
6635,@ojos_coloraos,https://pbs.twimg.com/profile_images/1305320750312763394/2W63AGMF_normal.jpg,Donde estabas vos ahora solo me acompaña un porro 🌴🍹🚬,https://pbs.twimg.com/media/EN8eGlKXsAA9uiP?format=jpg&name=small,false,,,,,,POSITIVE
6636,@debillorenzo,https://pbs.twimg.com/profile_images/1504271306631516161/xVeQbLeJ_normal.jpg,Venía re depre. Me fumé un porro y ahora estoy pasando por 3 estados y se los voy a mostrar con imágenes en perfecto orden,"https://pbs.twimg.com/media/EN9VrgEXsAAxGhI?format=jpg&name=360x360,https://pbs.twimg.com/media/EN9VronWsAExyIm?format=jpg&name=360x360,https://pbs.twimg.com/media/EN9VrwoXsAEll1p?format=jpg&name=360x360",false,,,,,,POSITIVE
6637,@ilagamw,https://pbs.twimg.com/profile_images/1720134399738449920/1GV5emnY_normal.jpg,"Necesito Un
porro",,false,,,,,,POSITIVE
6638,@melaatorress,https://pbs.twimg.com/profile_images/1856551955537018880/GZWkObEE_normal.jpg,Me crucé a mi ex profesora del secundario mientras me estaba fumando un porro,https://pbs.twimg.com/media/EOHX__VX0AAvefD?format=jpg&name=240x240,false,,,,,,POSITIVE
6639,@pablitoynomix,https://pbs.twimg.com/profile_images/1744970411010404352/kPRjN9hr_normal.jpg,Estoy enojado porque no pude cortarme el cabello y feliz porque me estoy fumando un porro.,https://pbs.twimg.com/media/EOGzMAFX4AALPyi?format=jpg&name=900x900,false,,,,,,POSITIVE
6640,@theonlxreason,https://pbs.twimg.com/profile_images/1475971842875682817/-cDR3Vq3_normal.jpg,ayer me fume un porro de prensado antes de dormir y mi vieja me mando esto JAJAJAJAAJjs que mujer,https://pbs.twimg.com/media/EOLjyZiWsAI2CwT?format=jpg&name=small,false,,,,,,POSITIVE
6641,@CjsLula,https://pbs.twimg.com/profile_images/1841305844945735700/RLzJZAyV_normal.jpg,Siendo las 00.11 nos vamos a fumar un porro porque hoy cumple el brodi  y no se hace otra cosa,https://pbs.twimg.com/media/EONfFIzXsAAyNLi?format=jpg&name=small,false,,,,,,POSITIVE
6642,@debillorenzo,https://pbs.twimg.com/profile_images/1504271306631516161/xVeQbLeJ_normal.jpg,Después de fumarme un porro se me da por comerme cualquier fruta que encuentre cerca,https://pbs.twimg.com/media/EOSP-z3WkAAxbQt?format=jpg&name=small,false,,,,,,POSITIVE
6643,@nenbdbdnakdjfj,https://pbs.twimg.com/profile_images/1183877164334305287/_Iz_oUvt_normal.jpg,se me acaba de caer un porro entero por el balcón,https://pbs.twimg.com/ext_tw_video_thumb/1216930330067767296/pu/img/El3j8oEpklJwp_9Z.jpg,false,,,,,,POSITIVE
6644,@Maugustico,https://pbs.twimg.com/profile_images/1457591567884210177/5i7IXMb7_normal.jpg,Que rico un capuccino y un porro después de almuerzo.,https://pbs.twimg.com/media/EOwGiKuX4AIGIc4?format=jpg&name=small,false,,,,,,POSITIVE
6645,@KoeSmoke,https://pbs.twimg.com/profile_images/1821779629369143297/6W7sKZde_normal.jpg,Un porro y rap para esta noche fría.,,false,,,,,,POSITIVE
6646,@chechizabe,https://pbs.twimg.com/profile_images/1875959343247409153/fUT_e3OM_normal.jpg,"Necesito fumarme un porro con el negro y tocar muchos temas que solo con el puedo hablar de manera rancia mal, que tipo malo es como lo amo. Te extraño ",https://pbs.twimg.com/tweet_video_thumb/EPAAt3TX4AApR74.jpg,false,,,,,,POSITIVE
6647,@leexcabrera,https://pbs.twimg.com/profile_images/1454435317117853697/l53grrTg_normal.jpg,Ya solo me fumo un porro al deía,https://pbs.twimg.com/media/EO_ZcR4W4AA_OZw?format=jpg&name=small,false,,,,,,POSITIVE
6648,@mmpizarrom,https://pbs.twimg.com/profile_images/1881012420690296832/-4nvxKyC_normal.jpg,me he fumado un porro meás grande que mi cabeza y me estoy hartando a galletas y con este detalle que tanto os importa buenas noches (:,https://pbs.twimg.com/media/EPGYgJBXUAEZl89?format=jpg&name=small,false,,,,,,POSITIVE
6649,@dany_artpop,https://pbs.twimg.com/profile_images/1682959528122253314/ltJL0xeb_normal.jpg,"Estoy en medio de la nada, todo es montaña arenosa salí a fumar un porro (solo traje dos) lo deje en el bolsillo, llego a casa y me di cuenta que se cayó. Salí a buscarlo con la linterna del celu caminado media cuadra con tan buena suerte que lo encontré jajaja 😂",https://pbs.twimg.com/media/EPGq3k7W4AAfwtn?format=jpg&name=small,false,,,,,,POSITIVE
6650,@brillotriplexl,https://pbs.twimg.com/profile_images/1564462787824427009/hr9hEEyD_normal.jpg,A k nivel de pelotudez llegamos k pusimos un porro en una armonika y le decimos flauta,https://pbs.twimg.com/ext_tw_video_thumb/1225129295330209793/pu/img/z-En9F7cBIzXM06n.jpg,false,,,,,,POSITIVE
6651,@lpzmmica777,https://pbs.twimg.com/profile_images/1772994525994053632/3F3PqRxk_normal.jpg,quiero un porro o tres,,false,,,,,,POSITIVE
6652,@_ninamay,https://pbs.twimg.com/profile_images/1596626077752885251/6FVa2wlH_normal.jpg,Extraño salir a fumar un porro en tu escalerita,,false,,,,,,POSITIVE
6653,@pasall_,https://pbs.twimg.com/profile_images/1741922451561287680/lz-nPkRC_normal.jpg,Ayer me fumé un porro solo y me dormí viendo Rupaul mientras comía chocolate.,https://pbs.twimg.com/ext_tw_video_thumb/1231223143966085120/pu/img/Jx3RgF07LXanQrqK.jpg,false,,,,,,POSITIVE
6654,@AaixaRe,https://pbs.twimg.com/profile_images/1839826911402278912/QZAhQzSj_normal.jpg,"Quiero fumarme un porro, comer y [SEXUAL]... pido mucho ?",,false,,,,,,POSITIVE
6655,@lafemmemon,https://pbs.twimg.com/profile_images/1526991681333100548/iZqof2Cl_normal.jpg,"Mi traje, mis botas y un porro en mi boca 🤠","https://pbs.twimg.com/media/ERbnywoXYAA6dNu?format=jpg&name=small,https://pbs.twimg.com/media/ERbnywnX0AEmmtB?format=jpg&name=small",false,,,,,,POSITIVE
6656,@lourdessvera_,https://pbs.twimg.com/profile_images/1853970502999511049/GPGs35Wl_normal.jpg,ayer arme un porro hermoso,,false,,,,,,POSITIVE
6657,@nsbknd,https://pbs.twimg.com/profile_images/1582422244730540033/t0ZazZRg_normal.jpg,"Me fume un porro con esta tranquilidad, toy muy feliz les juro",https://pbs.twimg.com/ext_tw_video_thumb/1231967236665028610/pu/img/DW-0T1NG9tDpXdbG.jpg,false,,,,,,POSITIVE
6658,@anaceccone,https://pbs.twimg.com/profile_images/1882798182649765888/5ukvwn36_normal.jpg,Que ganas de fumarme un porro...,https://pbs.twimg.com/media/ERlEZgGUwAAcXz1?format=jpg&name=small,false,,,,,,POSITIVE
