ID,TweetAuthor,TweetAvatar,TweetText,TweetImages,IsTweetAReply,QuoteAuthor,QuoteAvatar,QuoteText,QuoteImages,IsQuoteAReply,Categorization
7974,@naranjagria,https://pbs.twimg.com/profile_images/857607399062065153/bLmK00qh_normal.jpg,"No me puedo dormir, quien me manda a tomar merca berreta un....que dia es hoy?",https://pbs.twimg.com/media/C2_BVjkWIAAzpTC?format=jpg&name=small,false,,,,,,POSITIVE
7975,@txarinmyheart,https://pbs.twimg.com/profile_images/1518188667621326848/WMRNBZWQ_normal.jpg,"tomar merca no te hace alto drogadicto, no voy a salir a vender a mi perro para ir a comprar que flashean",,false,,,,,,POSITIVE
7976,@rrociobosio,https://pbs.twimg.com/profile_images/1877429107157344256/-gpEfOhV_normal.jpg,unas ganas de tomar merca eu,,false,,,,,,POSITIVE
7977,@tuca_la,https://pbs.twimg.com/profile_images/646875806808023044/MnnSyFsm_normal.jpg,Los días de lluvia son para tomar merca solo,,false,,,,,,POSITIVE
7978,@TanFumado1,https://pbs.twimg.com/profile_images/1868547692860723200/zRcph8Ll_normal.jpg,tengo mas ganas de tomar merca que [PERSONA],,false,,,,,,POSITIVE
7979,@ivancithocjs,https://pbs.twimg.com/profile_images/1002065759965712385/3-PGC8MY_normal.jpg,Voy a colar pepa tomar merca y ahi de seguro me sienta bien!,,false,,,,,,POSITIVE
7980,@lazagraziano_,https://pbs.twimg.com/profile_images/1623211464751296513/pzwdS4M9_normal.jpg,ya ni tomar merca en la mesada puedo,,false,,,,,,POSITIVE
7981,@budaloco,https://pbs.twimg.com/profile_images/1552845822966267905/vcZyNvnc_normal.jpg,cuando me jubile voy a tomar merca para estar despierto hasta tarde...,,false,,,,,,POSITIVE
7982,@ulisesdumond,https://pbs.twimg.com/profile_images/378800000691466626/419fa0adc7516eff0329516b2ddfee65_normal.jpeg,"Si no tomo merca no me dan ganas de hacer nada, pero si tomo merca me dan ganas de tomar merca. óaunamigo ",,false,,,,,,POSITIVE
7983,@danelectro0,https://pbs.twimg.com/profile_images/738605292/29_normal.jpg,voy a tomar merca hasta el fin del mundo,,false,,,,,,POSITIVE
7984,@EdgarCasBe,https://pbs.twimg.com/profile_images/443800763844669440/5qqMh8Gx_normal.jpeg,tengo dolor de cabeza y tengo que tomar merca alguien quiere mi lugar,,false,,,,,,POSITIVE
7985,@chapajbb,https://pbs.twimg.com/profile_images/999359733201960960/H2Av64-J_normal.jpg,"deberia al menos tomar merca... estoy muy careta, and hating it",,false,,,,,,POSITIVE
7986,@chapajbb,https://pbs.twimg.com/profile_images/999359733201960960/H2Av64-J_normal.jpg,"discutiendo si: tomar merca, [GROSERIA], comer danette, o fumar porro",,false,,,,,,POSITIVE
7987,@perrotriciclo,https://pbs.twimg.com/profile_images/1389359468/perroBN_normal.png,"fumar faso, tomar merca, fumar paco, una pepa, quetamina y una cervecita de vez en cuando placeres sencillos",,false,,,,,,POSITIVE
7988,@chapajbb,https://pbs.twimg.com/profile_images/999359733201960960/H2Av64-J_normal.jpg," de hecho yo tengo media lapicera bic para tomar merca, de las azules",,false,,,,,,POSITIVE
7989,@andreslavariega,https://pbs.twimg.com/profile_images/1164319705794076673/o_hulQ-t_normal.jpg,como... otro semestre que no podre tomar merca!!!,,false,,,,,,POSITIVE
7990,@Catamarco,https://pbs.twimg.com/profile_images/1426214062698999809/aSYJlo-N_normal.jpg,Hoy es un deía para tomar merca del bidet.,,false,,,,,,POSITIVE
7991,@PobreAngelito2,https://pbs.twimg.com/profile_images/1051127368906153984/dQj7PnwE_normal.jpg,Debería dejar de tomar merca antes de comer,,false,,,,,,POSITIVE
7992,@damiuno,https://pbs.twimg.com/profile_images/1398788414443606017/Da0GPkjH_normal.jpg,Prefiero tomar merca antes de esas boludeces que toman,,false,,,,,,POSITIVE
7993,@bajoelcinco,https://pbs.twimg.com/profile_images/1173505501109411840/q54mu0IE_normal.jpg,Alguien me quiere invitar a tomar merca? Yo pongo los cigarros,,false,,,,,,POSITIVE
7994,@_LucasGonzalez1,https://pbs.twimg.com/profile_images/1874277804746915840/PWXCJIB7_normal.jpg,Unas ganas de tomar merca,,false,,,,,,POSITIVE
7995,@thiiagososa,https://pbs.twimg.com/profile_images/1795859768898093056/PrZYClUk_normal.jpg,vamos a tener que empezar a tomar merca con los gurices para terminar el repertorio,,false,,,,,,POSITIVE
7996,@Jacqueline00_,https://pbs.twimg.com/profile_images/1582827538061135891/nq16tKxx_normal.jpg,"Termine el primer deía del año con un ""ataque"" al corazon por tomar merca, creo que llegue al punto extremo",,false,,,,,,POSITIVE
7997,@Pedrito_Vm,https://pbs.twimg.com/profile_images/1866595362951106560/fGb9P9yD_normal.jpg,"Tengo ganas de fumar porro, tomar merca e inyectarme cocaína liquida",,false,,,,,,POSITIVE
7998,@999emiirrr,https://pbs.twimg.com/profile_images/1875320973227900928/zklnFDE6_normal.jpg,lo hicimos tomar merca a darían y salio mal,,false,,,,,,POSITIVE
7999,@Patitopex,https://pbs.twimg.com/profile_images/1058934164685242368/2YJOluAH_normal.jpg,Tengo mas ganas de tomar merca que vivir,,false,,,,,,POSITIVE
8000,@braandon31,https://pbs.twimg.com/profile_images/1532069725131390978/Mcl9U1MS_normal.jpg,Y yo unas ganas de tomar merca y quedar re duro en la esquina amigo😒,,false,,,,,,POSITIVE
8001,@MiluPalmeyro,https://pbs.twimg.com/profile_images/1732637548558573568/7biq6zk7_normal.jpg,Unas ganas de tomar merca,,false,,,,,,POSITIVE
8002,@LuciaDia_z,https://pbs.twimg.com/profile_images/1773080124017025024/6tK3431R_normal.jpg,Voy a empezar a tomar merca así adelgazo un poco.,,false,,,,,,POSITIVE
8003,@damnrian,https://pbs.twimg.com/profile_images/1847092921301921792/UYMSWjOF_normal.jpg,que miedo la gente que se enamora despues de los 20 para mi esta edad solo existe para tomar merca,,false,,,,,,POSITIVE
8004,@santikjs,https://pbs.twimg.com/profile_images/1693786774835707904/djNOyA7o_normal.jpg,me voy a tomar merca,,false,,,,,,POSITIVE
8005,@RuizConra,https://pbs.twimg.com/profile_images/1371263270275981315/DM7pAW1N_normal.jpg,Unas ganas de tomar merca,,false,,,,,,POSITIVE
8006,@florciittt,https://pbs.twimg.com/profile_images/1712240715567181824/lmo7ihmO_normal.jpg,Eh tenemos que tomar merca,,false,,,,,,POSITIVE
8007,@Fry431,https://pbs.twimg.com/profile_images/1405102001/227570_10150201005576657_569361656_7453822_4292906_n_normal.jpg,"Si no bajo 4 kilos para fin de mes, arranco a tomar merca.",,false,,,,,,POSITIVE
8008,@tyler_soriano,https://pbs.twimg.com/profile_images/1280361037951361029/m29X8yJy_normal.jpg,Ya está ya termino de destruir mi vida me voy a quedar encerrado en mi casa a tomar merca yo no me muevo de acá estoy meás que triste y destruido,,false,,,,,,POSITIVE
8009,@adarosanti_,https://pbs.twimg.com/profile_images/1078585572820697088/bBkFElKN_normal.jpg,"Tengo ganas de fumar porro, tomar merca e inyectarme una sobredosis de cocaína y marihuana
Venga a las 6 traigan jeringa",,false,,,,,,POSITIVE
8010,@GuilleeSSJ,https://pbs.twimg.com/profile_images/1763312955112783873/6qNajXh1_normal.jpg,Re esta para tomar merca,,false,,,,,,POSITIVE
8011,@La_Ruiz_,https://pbs.twimg.com/profile_images/654682251947413504/dJ3QtP-h_normal.jpg,No necesito extasis.. Porque con el me siento en otro mundo..,,false,,,,,,NEGATIVE
8012,@shivababy_,https://pbs.twimg.com/profile_images/1885420056148140033/AAoFUao7_normal.jpg,No necesito éxtasis si puedo llenarme las manos de Rocainol.,,false,,,,,,NEGATIVE
8013,@SpunKgen,https://pbs.twimg.com/profile_images/1878201492877766656/lqHD9afl_normal.jpg,"Contigo no necesito éxtasis para"" flotar!!",,false,,,,,,NEGATIVE
8014,@Gon_Killer,https://pbs.twimg.com/profile_images/2326212396/image_normal.jpg,Con la banda Love of Lesbian no necesito éxtasis.,,false,,,,,,NEGATIVE
8015,@Cecys_6,https://pbs.twimg.com/profile_images/1660128461569114112/t7Itvfr4_normal.jpg,Necesito Éxtasis... de felicidad..,,false,,,,,,NEGATIVE
8016,@Arturo5Estrella,https://pbs.twimg.com/profile_images/672259190900039680/ZX4Fx4wx_normal.jpg,"""Pero yo no necesito éxtasis para quererte""",,false,,,,,,NEGATIVE
8017,@anxcami,https://pbs.twimg.com/profile_images/1782040932528922624/oKZSn3rq_normal.jpg,"Soy un zombie, no se como me voy a despertar para ir a trabajar. Necesito éxtasis(? ah",,false,,,,,,NEGATIVE
8018,@ainhoaxsr,https://pbs.twimg.com/profile_images/1810344126879072257/EfTPEiIb_normal.jpg,"Necesito 'Éxtasis' , la canción de Pablo Alborán urgente de:",,false,,,,,,NEGATIVE
8019,@JuanmaMarelli,https://pbs.twimg.com/profile_images/581685967301529600/l9xTZ9l6_normal.jpg,"No necesito éxtasis para sentir que vuelo, con solo auriculares y meúsica ya estoy en las nubes",,false,,,,,,NEGATIVE
8020,@VargasPetunia,https://pbs.twimg.com/profile_images/1643094882448203776/bW1o2WTZ_normal.jpg,"Lo admito no necesito éxtasis, la musica es mi droga.",,false,,,,,,NEGATIVE
8021,@ariannavillab,https://pbs.twimg.com/profile_images/1883560383807389696/ipblLhY3_normal.jpg,"Necesito ""Éxtasis de Gabriel"" y ""Redención de Gabriel"" MAMI, NECESITO LIBROS, URGENTE",,false,,,,,,NEGATIVE
8022,@GastyMond,https://pbs.twimg.com/profile_images/1870583236297932800/58YSfTXs_normal.jpg,Necesito éxtasis en mi vida porque parecería que estuviese llena de suero.,,false,,,,,,NEGATIVE
8023,@finderswalls,https://pbs.twimg.com/profile_images/1771668213492854784/uMNollhD_normal.jpg,y yo necesito extasis de vos ahre,,false,,,,,,NEGATIVE
8024,@alwayswithme75,https://pbs.twimg.com/profile_images/1154745904017993728/LNArB-o3_normal.jpg,Necesito éxtasis en mi vida....,,false,,,,,,NEGATIVE
8025,@solirenzo,https://pbs.twimg.com/profile_images/1859663354891005952/Ql5L4BW9_normal.jpg,"yo estaba re anti pero no sé cómo terminé gritando los penales de hoy,, te amo [PERSONA] necesito éxtasis de mundiAL y felicidad",https://pbs.twimg.com/media/E5qkV0_XIAQVWpU?format=jpg&name=small,false,,,,,,NEGATIVE
8026,@nayratenam_,https://pbs.twimg.com/profile_images/1677806996597227525/4HCE7_Uc_normal.jpg,Tu eres mi droga no necesito éxtasis,,false,,,,,,NEGATIVE
8027,@inesveg4,https://pbs.twimg.com/profile_images/1808084916774518784/kLJ7P2NM_normal.jpg,tu eres mi droga no necesito éxtasis,,false,,,,,,NEGATIVE
8028,@mercenarioneta,https://pbs.twimg.com/profile_images/1574599947076259841/X1NlO7C7_normal.jpg,"Aquí dice claramente que teú eres mi droga, no necesito extasis ?si=H4erUxZOQ06XWd6RfTW8Bg…",,true,,,,,,NEGATIVE
8029,@IrinaNazaretR,https://pbs.twimg.com/profile_images/1839549340874129408/QnXPVRgN_normal.jpg,Necesito éxtasis de paz,,false,,,,,,NEGATIVE
8030,@Rivvas_2k,https://pbs.twimg.com/profile_images/1857919238859554816/-aLdVcOQ_normal.jpg,Necesito éxtasis 24/7,,false,,,,,,NEGATIVE
8031,@Mybiasforsure,https://pbs.twimg.com/profile_images/1866640432001683456/OcrApdst_normal.jpg,Necesito éxtasis o mil abrazos a ver si logro organizar esta cochinada de trasteo.,,false,,,,,,NEGATIVE
8032,@__nahiir,https://pbs.twimg.com/profile_images/1813651163939577856/UmVZsZIO_normal.jpg,tu eres mi droga no necesito éxtasis,,false,,,,,,NEGATIVE
8033,@BAISCHX0,https://pbs.twimg.com/profile_images/1879681127486500866/OabDFZd8_normal.jpg,eres mi droga no necesito éxtasis,,false,,,,,,NEGATIVE
8034,@elkarzo,https://pbs.twimg.com/profile_images/1709784934561292288/kjJnh-Wb_normal.jpg,"Ahora sonando ""tuvan by gaia"" (a.k.a   ) amo esta rola!!! no necesito extasis para volar con esa rola",,false,,,,,,NEGATIVE
8035,@elkarzo,https://pbs.twimg.com/profile_images/1709784934561292288/kjJnh-Wb_normal.jpg,"Ahora sonando ""tuvan by gaia"" (a.k.a  ) amo esta rola!!! no necesito extasis para volar con esa rola",,false,,,,,,NEGATIVE
8036,@Mary_sk8,https://pbs.twimg.com/profile_images/1581023309411635205/UKMYNcHN_normal.jpg,Yo no necesito extasis para sentir cosas.. con solo tomar tu mano mi cuerpo comienza a danzar en un mismo sitio.,,false,,,,,,NEGATIVE
8037,@HaddyPosada,https://pbs.twimg.com/profile_images/1748786565441073152/cPY1YKOq_normal.jpg,"Estoy viendo una pelicula& al tipo le dieron extasis. Se puso bn loco, bn hipperfeliz todo relax!Moraleja de la pelicula: Necesito extasis:de",,false,,,,,,NEGATIVE
8038,@LuisRojano31,https://pbs.twimg.com/profile_images/981939179310469122/vOwEbKZ9_normal.jpg,necesito éxtasis de felicidad :) para poder seguir con mi vida normalmente pero el problema es donde las consigo? :s ,,false,,,,,,NEGATIVE
8039,@Jeffrigerador,https://pbs.twimg.com/profile_images/378800000041316351/40b921cf704377c8c34d4f6428ffa052_normal.jpeg,Necesito éxtasis de felicidad instantánea,,false,,,,,,NEGATIVE
8040,@Florbero,https://pbs.twimg.com/profile_images/1491302480730554368/KPP4rvJ2_normal.jpg,"No necesito extasis para disfrutar de la musica electronica, con solo escucharla entro en estado extasis",,false,,,,,,NEGATIVE
8041,@ralf2510,https://pbs.twimg.com/profile_images/574056231754665985/9lQqRPWK_normal.jpeg,Necesito éxtasis mental.,,false,,,,,,NEGATIVE
8042,@EryMuse,https://pbs.twimg.com/profile_images/1743017029991378944/APfY3bWZ_normal.jpg,"necesito éxtasis para sentirme bien aunque solo sea por un rato, o al menos inyectame de tu adrenalina!",,false,,,,,,NEGATIVE
8043,@GTrevignani,https://pbs.twimg.com/profile_images/758710402259755009/zbdqrGyL_normal.jpg,Necesito éxtasis directamente en mis terminales nerviosas cerebrales...,,false,,,,,,NEGATIVE
8044,@Sabridamore,https://pbs.twimg.com/profile_images/1162772946630447107/tGP83wEV_normal.jpg,"No necesito éxtasis para volar, con tus besos basta.",,false,,,,,,NEGATIVE
8045,@EsaSonrisaTuya,https://pbs.twimg.com/profile_images/1390730575984607247/dSdZ8o4n_normal.jpg,ah por cierto me acabo de tomar un cafe bastante cargado y aun asi no creo que aguante. Necesito éxtasis xD,,false,,,,,,NEGATIVE
8046,@andreaishere,https://pbs.twimg.com/profile_images/1607668123783544833/Yp66u2Yw_normal.jpg,"  necesito extasis en catalan. XD",,false,,,,,,NEGATIVE
8047,@SpunKgen,https://pbs.twimg.com/profile_images/1878201492877766656/lqHD9afl_normal.jpg,"Contigo no necesito éxtasis para"" flotar!!",,false,,,,,,NEGATIVE
8048,@TarritoDeAzucar,https://pbs.twimg.com/profile_images/1792323508069904385/uRVqz4JJ_normal.jpg,Yo no necesito éxtasis para volar,,false,,,,,,NEGATIVE
8049,@kebelynRodrigez,https://pbs.twimg.com/profile_images/734902110639247360/9F0Cqgvp_normal.jpg,Necesito éxtasis de chocolate by dolce incontro por favor ☹,,false,,,,,,NEGATIVE
8050,@mariana_sym,https://pbs.twimg.com/profile_images/1793404386036649984/i8T9ipSK_normal.jpg,"Yo no necesito éxtasis, yo te necesito a ti.",,false,,,,,,NEGATIVE
8051,@Matella_7,https://pbs.twimg.com/profile_images/1741967819216957440/W1kUia-K_normal.jpg,"  espero qe para tu cumple hagas una fiesta porqe necesito extasis jajajaja",,false,,,,,,NEGATIVE
8052,@EnClaveDSol,https://pbs.twimg.com/profile_images/1538629778584047616/4VrpXGuU_normal.jpg,"No necesito éxtasis, tengo un paquete de me&me's.",,false,,,,,,NEGATIVE
8053,@memiliablan,https://pbs.twimg.com/profile_images/1816893848607432704/fm79MlYw_normal.jpg,me agarro una re cosa de extrañar a ri y las charlas!!! necesito extasis de su locura,,false,,,,,,NEGATIVE
8054,@Hector_rcc24,https://pbs.twimg.com/profile_images/552959917863477249/eoc0G0e1_normal.jpeg,Yo no necesito éxtasis para eso tengo a las mujeres ☑,,false,,,,,,NEGATIVE
8055,@Joha_lpz,https://pbs.twimg.com/profile_images/546128878876368896/I7g8DeTO_normal.jpeg,Necesito éxtasis de felicidad.,,false,,,,,,NEGATIVE
8056,@montenegromix,https://pbs.twimg.com/profile_images/1424576183375642627/wfrj9Lu1_normal.jpg,"Parezco drogado, si me vieran. ¿Ven? Yo no necesito extasis.",,false,,,,,,NEGATIVE
8057,@naachosz,https://pbs.twimg.com/profile_images/1141588511788806144/TPk4Kmj5_normal.png,"No necesito extasis ni cocaina, la musica me lleva a otro mundo donde yo soy el unico rey.",,false,,,,,,NEGATIVE
8058,@raandylo,https://pbs.twimg.com/profile_images/1474241885766094851/ICprCYJi_normal.jpg,"Necesito éxtasis para mi cerebro, para ser meás inteligente, así dicen.",,false,,,,,,NEGATIVE
8059,@gerardospain,https://pbs.twimg.com/profile_images/1414432677684514816/EcT75gzc_normal.jpg,"Yo no necesito extasis, con el dubstep me basta :)",,false,,,,,,NEGATIVE
8060,@MALUVE1283,https://pbs.twimg.com/profile_images/794005936088248320/aFVKjEHx_normal.jpg," necesito ayuda para conseguir unos libros de nicolle jordan, necesito extasis, deseo y lujuria porfa no se donde encontrarlos",,false,,,,,,NEGATIVE
8061,@JaimeNavarretee,https://pbs.twimg.com/profile_images/1524459691157381121/Xkv3YkFa_normal.jpg,para que necesito éxtasis si mi droga son las pastillitas de menta,,false,,,,,,NEGATIVE
8062,@lazsZavala,https://pbs.twimg.com/profile_images/1321548722153639939/ea_tDtgz_normal.jpg,Yo no necesito extasis para' flotar por que siento que floto cuando estoy con Marthaby asi..,,false,,,,,,NEGATIVE
8063,@_DreamWorlds_,https://pbs.twimg.com/profile_images/1359530171129352194/Y9rg0cil_normal.jpg,"No necesito extasis para volar bien lejos, con mi extensa imaginacion basta.",,false,,,,,,NEGATIVE
8064,@Adictiva_____,https://pbs.twimg.com/profile_images/378800000228020015/b507f40487949d623a25e7ddbef91f90_normal.jpeg,"No necesito extasis, porque te tengo a ti.",,false,,,,,,NEGATIVE
8065,@kimberrlyy_,https://pbs.twimg.com/profile_images/954712155496091648/WQyM1q09_normal.jpg,"he aprendido que para alucinar no necesito éxtasis, necesito estar enamorada sola.",,false,,,,,,NEGATIVE
8066,@glowsparks,https://pbs.twimg.com/profile_images/1300278547135836161/vWGPRQKO_normal.jpg,Evidentemente necesito extasis. Urgente! ya! *arre que nunca la probó*,,false,,,,,,NEGATIVE
8067,@Satisfakshon,https://pbs.twimg.com/profile_images/720847581702533120/s6JVSQve_normal.jpg,Hoy en biología me tomaron la presión y tenía el corazón re lento.. Creo que necesito éxtasis.,,false,,,,,,NEGATIVE
8068,@lau_alejandra18,https://pbs.twimg.com/profile_images/894007118495453186/b9rEScpj_normal.jpg,"Necesito éxtasis en mi vida , un amor que me entienda sin tantos. Problemas , que tenga miedo de amar",,false,,,,,,NEGATIVE
8069,@WilberLunaa,https://pbs.twimg.com/profile_images/1882276239135633408/VNhw-Tv-_normal.jpg," No necesito éxtasis, no es necesario ;)",,true,,,,,,NEGATIVE
8070,@SilPirb,https://pbs.twimg.com/profile_images/1432240902743937024/s1YH4dSQ_normal.jpg,"No necesito éxtasis, ni coca, ni marihuana. Solo meúsica.",,false,,,,,,NEGATIVE
8071,@Alborandb,https://pbs.twimg.com/profile_images/481943464289239040/RGFu5f1m_normal.jpeg,"Necesito ""ÉXTASIS"" en directoooooooo!!! Concierto de  en meÁLAGA YAA PORFAVOOOOR!! *-*",,false,,,,,,NEGATIVE
8072,@AlfredoFields,https://pbs.twimg.com/profile_images/873427397969936384/HMQJxHjN_normal.jpg,"Necesito éxtasis, te necesito a ti.",,false,,,,,,NEGATIVE
8073,@MaybeDu,https://pbs.twimg.com/profile_images/1296205943370326020/S0kiKC2M_normal.jpg,Necesito éxtasis de abrazos y muchos besos.,,false,,,,,,NEGATIVE
8074,@LupisCondeC,https://pbs.twimg.com/profile_images/520203442326093824/n_-yMa0D_normal.jpeg,"Necesito éxtasis,te necesito a ti.",,false,,,,,,NEGATIVE
8075,@chris_asecas,https://pbs.twimg.com/profile_images/1627712944107663360/yvoPa9Yk_normal.jpg,Necesito éxtasis a mis sentidos...,,false,,,,,,NEGATIVE
8076,@lauragbuen,https://pbs.twimg.com/profile_images/1625090703972790273/hhJWG-Gh_normal.jpg,"No necesito porros porque tu amor me ciega, no necesito alcohol porque  tu saliva me desihnive, no necesito éxtasis porque tu presencia ya me altera.",,false,,,,,,NEGATIVE
8077,@Ausklei,https://pbs.twimg.com/profile_images/572463556077232129/YnGJj2kE_normal.jpeg,No necesito éxtasis si sonríes.,,false,,,,,,NEGATIVE
8078,@lauraes85325030,https://pbs.twimg.com/profile_images/449567823611060225/BfGSt5VH_normal.jpeg,No necesito éxtasis si sonríes.,,false,,,,,,NEGATIVE
8079,@IWantWildSex,https://pbs.twimg.com/profile_images/3278938978/513ee3106c4b320ecc85b869da6e8d95_normal.jpeg,"No necesito cannabis, no necesito éxtasis, no necesito cocaína, no necesito marihuana. Mi droga se llama meúsica. Pruébala.",,false,,,,,,NEGATIVE
8080,@Mar_girl_,https://pbs.twimg.com/profile_images/1108583529716371456/3-tgFAHR_normal.jpg,"No necesito éxtasis para volar, contigo me basta.",,false,,,,,,NEGATIVE
8081,@v_antonio23,https://pbs.twimg.com/profile_images/1162993888963059712/NPt1OXo__normal.jpg,Porfavor hoy necesito extasis o algo de esta [DISCRIMINACION] literatura y lo peor es que no llevo ni 1 hora.,,false,,,,,,NEGATIVE
8082,@SrtaMari_huana,https://pbs.twimg.com/profile_images/3307107378/66959c031f200906edc2792ed1d86cc4_normal.jpeg,"No necesito cannabis, no necesito éxtasis, no necesito cocaína, no necesito marihuana. Mi droga se llama meúsica. Pruébala.",,false,,,,,,NEGATIVE
8083,@nachomardones,https://pbs.twimg.com/profile_images/1265662675750727686/l9b_tEtd_normal.jpg,Necesito éxtasis de Los Auténticos Decadentes!!,,false,,,,,,NEGATIVE
8084,@rodo_palma_,https://pbs.twimg.com/profile_images/1738008873142026241/FzZQgVt7_normal.jpg,Como dicen por hay yo no necesito éxtasis para volar,,false,,,,,,NEGATIVE
8085,@Andreacarpiofer,https://pbs.twimg.com/profile_images/1242731137874702339/wYBWM2gw_normal.jpg,¿Para que necesito éxtasis si tengo meúsica?,,false,,,,,,NEGATIVE
8086,@Laauuz,https://pbs.twimg.com/profile_images/581237680945520640/7_iAIEr1_normal.jpg,No necesito éxtasis cuando puedo hacer el amor contigo siempre.,,false,,,,,,NEGATIVE
8087,@LeoJSanchezG,https://pbs.twimg.com/profile_images/1543044284542246914/Hmq0HbRU_normal.jpg,"No necesito extasis para llegar alto, solo necesito que vengas y me beses, es todo.",,false,,,,,,NEGATIVE
8088,@feldmanbrian,https://pbs.twimg.com/profile_images/2899586367/67a19e65174053cff27c846eab876edf_normal.jpeg,Como te extraño boquita! Necesito extasis de vosss!!,,false,,,,,,NEGATIVE
8089,@Letmeburn96,https://pbs.twimg.com/profile_images/726748990549680128/95R8OuvD_normal.jpg,Me acabo de dar cuenta que no necesito éxtasis para sentirme en el [DISCRIMINACION] cielo. Ya le tengo a él & me siento incluso mejor.,,false,,,,,,NEGATIVE
8090,@QueenBitchPro,https://pbs.twimg.com/profile_images/1182712136088338432/_Dz_Jij3_normal.jpg,No necesito extasis cuando el simple hecho de estar contigo me lleva a sentir cosas que no pense que existían.,,false,,,,,,NEGATIVE
8091,@carlisimos_ff,https://pbs.twimg.com/profile_images/1223194239108030464/ePCPOmzN_normal.jpg,""" — ¿Marihuana? ¿Cocaína? ¿Heroína? ¿Cannabis? ¿Metadona? ¿Valeriana? ¿Ritalin? ¿ tripis? — No, yo solo necesito éxtasis.",,false,,,,,,NEGATIVE
8092,@Alaan_Garcia,https://pbs.twimg.com/profile_images/1785435141357072384/tjoQYIrQ_normal.jpg,Posta que yo NO necesito extasis para estar manija con punchi todo el dia ! =de,,false,,,,,,NEGATIVE
8093,@Casadosk28,https://pbs.twimg.com/profile_images/1324267998534918150/VSkidOTn_normal.jpg,No necesito éxtasis solo te necesito a ti.,,false,,,,,,NEGATIVE
8094,@Lia_Herradar,https://pbs.twimg.com/profile_images/503646487361105920/PBZSrNpn_normal.jpeg,Yo no necesito éxtasis para bailar toda la noche.,,false,,,,,,NEGATIVE
8095,@poshiita_,https://pbs.twimg.com/profile_images/482403352139948032/PE1wj3af_normal.jpeg,Y desde octubre ... Ya no necesito éxtasis ..... Solo la necesito a ella♥,,false,,,,,,NEGATIVE
8096,@steven_unit,https://pbs.twimg.com/profile_images/701543912368947200/DqlwgGgQ_normal.jpg,No necesito extasis contigo ya tengo animos aunque no siempre lo parezca,,false,,,,,,NEGATIVE
8097,@SthephanieMeji1,https://pbs.twimg.com/profile_images/522132809226264577/o8E1Mop9_normal.jpeg,Necesito Éxtasis En Mi vida... Pero yaaaaaaa,,false,,,,,,NEGATIVE
8098,@Cesarodrigo_,https://pbs.twimg.com/profile_images/1886600865835827200/l9_vP8Ae_normal.jpg,Necesito éxtasis de felicidad pero ya.,,false,,,,,,NEGATIVE
8099,@JesseHrz,https://pbs.twimg.com/profile_images/1053071695223898112/A2cvFaKA_normal.jpg,"Yo no necesito éxtasis, ni ir con un psicólogo para sentirme mejor, con el hecho de ver a  en Que pobres tan ricos me hace el deía!",,false,,,,,,NEGATIVE
8100,@poetchandonn,https://pbs.twimg.com/profile_images/751801160655335424/fTjiZGvb_normal.jpg,Solo necesito 'extasis' de pablo alboran para ser feliz,,false,,,,,,NEGATIVE
8101,@Lugonis1,https://pbs.twimg.com/profile_images/911344049151504390/6WEbWBag_normal.jpg,"Tu me das alas que yo
necesitaba para volar, tu cuerpo me
da placer cuando yo necesito
éxtasis, tu vida esta en mi y mi
placer esta en ti.",,false,,,,,,NEGATIVE
8102,@karolayconcepci,https://pbs.twimg.com/profile_images/1480323207399940098/GdGGG1mE_normal.jpg,"para yo ponerme happy en barbarella no necesito extasis, la musica hace su trabajo.",,false,,,,,,NEGATIVE
8103,@BeckiiEztrada_,https://pbs.twimg.com/profile_images/648225545461760000/-btY5ktS_normal.jpg,No necesito extàsis para prenderte.,,false,,,,,,NEGATIVE
8104,@sandriuskyvk,https://pbs.twimg.com/profile_images/1349265764109451264/K7n6Xrze_normal.jpg,Le doy tanto a la meúsica que pf. No necesito éxtasis para venirme arriba.,,false,,,,,,NEGATIVE
8105,@Amir22luna,https://pbs.twimg.com/profile_images/1765917391739867137/bY6rW3DV_normal.jpg,Necesito éxtasis de Felicidad.,,false,,,,,,NEGATIVE
8106,@AleLeonelFranco,https://pbs.twimg.com/profile_images/626856449721913345/K5k5WcP4_normal.jpg,Necesito éxtasis de futbol,,false,,,,,,NEGATIVE
8107,@alexissensualon,https://pbs.twimg.com/profile_images/3642286405/1735b562c56232322bb1ae9d2e0fbc01_normal.jpeg,"No necesito Éxtasis,Te tengo a ti,Tu me llevas a la Éxtasis. ❤󾌧❤󾌧❤",,false,,,,,,NEGATIVE
8108,@Lafabio1008,https://pbs.twimg.com/profile_images/1296574801889329152/QyI9_787_normal.jpg,"Necesito éxtasis, y no hablo de la droga.",,false,,,,,,NEGATIVE
8109,@Mondo_tmm,https://abs.twimg.com/sticky/default_profile_images/default_profile_normal.png,"Necesito extasis de amor, cualquiera. El tuyo está bien",,false,,,,,,NEGATIVE
8110,@LoanaChaparro,https://pbs.twimg.com/profile_images/1620261787290435586/tgoC9oO-_normal.jpg,Necesito éxtasis de buenos momentos que nunca se acaben,,false,,,,,,NEGATIVE
8111,@JCamiloMFC,https://pbs.twimg.com/profile_images/1519200845790912513/zVfO2cCa_normal.jpg,"Pues necesito extasis de su mirada, su sonrisa.",,false,,,,,,NEGATIVE
