ID,TweetAuthor,TweetAvatar,TweetText,TweetImages,IsTweetAReply,QuoteAuthor,QuoteAvatar,QuoteText,QuoteImages,IsQuoteAReply,Categorization
7252,@el_rojo1917,https://pbs.twimg.com/profile_images/1820676222898114560/mAX9v8nM_normal.jpg,"Bueno no 100% comprobado porque se necesitaría tomar una linea base,aplicar la variable y volver a medir si tiene algun efecto.",,false,,,,,,NEGATIVE
7253,@bellatrizzz,https://pbs.twimg.com/profile_images/890636533488910341/19G82Uku_normal.jpg,Y de pronto puedo tomar una linea de cada canción para dedicartela!!,,false,,,,,,NEGATIVE
7254,@emiclapera,https://pbs.twimg.com/profile_images/463526865333137408/HcIhoGSf_normal.jpeg,[PERSONA] se fue a tomar una linea de merca y ahora vuelve..,,false,,,,,,NEGATIVE
7255,@Jhonn_delgado,https://pbs.twimg.com/profile_images/937632037162414080/nn9Vmrko_normal.jpg,"Este año esta siendo duro, esperemos que todo vuelva a tomar una linea mas facil de afrontar, la crisis esta haciendo mella por donde miras",,false,,,,,,NEGATIVE
7256,@Nereaf1,https://pbs.twimg.com/profile_images/1068258326197256193/ET-_HiQD_normal.jpg,ya me extrañaba a mi... esto de saltarse los dias era raro... pero todos los equipos estaban empezando a tomar una linea parecida,,false,,,,,,NEGATIVE
7257,@jroffo,https://pbs.twimg.com/profile_images/1427769092912594945/mLTvmRCS_normal.jpg,"Quiero que [PERSONA] me explique la diferencia entre ""tomar una línea de merca"" e ""inhalar cocaína"".",,false,,,,,,NEGATIVE
7258,@MellDaniela,https://pbs.twimg.com/profile_images/483428852215988224/IMA1ZR9U_normal.jpeg,tengo tanta mala suerte que cuando empiezo a tomar una linea de colectivo que me dajaba frente a casa cambia de recorrido...,,false,,,,,,NEGATIVE
7259,@LeaLebros,https://pbs.twimg.com/profile_images/1624187335523835906/QfNxfUno_normal.jpg,"Solo a mi se me ocurre aventurarme a tomar una linea que no conozco en esta lluvia, tener que bajar, caminar en la lluvia y tomar taxi…",,false,,,,,,NEGATIVE
7260,@Linkinhack,https://pbs.twimg.com/profile_images/1397789640296386561/d2Q8sL-5_normal.jpg,"porque sera?:... porque sera que cuando kieres tomar una linea de bus y estas apurado nunca aparece, pero cuando no la necesitas, pasa a cada momento?",,false,,,,,,NEGATIVE
7261,@alepinedogarcia,https://pbs.twimg.com/profile_images/1752320202040098816/3bOkVp4j_normal.jpg,Quiero tomar una linea de bus que me lleve a ninguna parte,,false,,,,,,NEGATIVE
7262,@elchichoperalta,https://pbs.twimg.com/profile_images/1860455753137467392/1BUdvg85_normal.jpg,Se enojo [PERSONA]! ja y se fue a tomar una linea,,false,,,,,,NEGATIVE
7263,@pepitadeoro,https://pbs.twimg.com/profile_images/1551418414090027008/EZpOLVW7_normal.jpg,En este paraís cuando hay que tomar una línea meóvil lo único que queda es escoger cuál será la que te timará.,,false,,,,,,NEGATIVE
7264,@Omiher,https://pbs.twimg.com/profile_images/491646752785965056/L5suV2SZ_normal.jpeg,"Odio a la gente que cree que por fumarse, tomar una linea o enpastillarse se la sabe toda!!",,false,,,,,,NEGATIVE
7265,@GoonDominguez,https://pbs.twimg.com/profile_images/1743335049561276416/UWx9mq6y_normal.jpg,"A mi no me pusieron un fierro en la cabeza y me hicieron fumar un porro, o tomar una linea de merca, el que lo hace lo hace porque QUIERE",,false,,,,,,NEGATIVE
7266,@LeanMatai,https://pbs.twimg.com/profile_images/958082802108588032/9joO5nPh_normal.jpg,"[PERSONA]: ""Yo tenía un amigo que por ahí se estaba armando un faso o se estaba por tomar una línea adelante meío, pero yo jamás toqué nada.""",,false,,,,,,NEGATIVE
7267,@simonmovicom,https://pbs.twimg.com/profile_images/1760308445897515008/UYiNIdqx_normal.jpg,Me voy a tomar una linea de tiempo.,,false,,,,,,NEGATIVE
7268,@MoreVeCorta,https://pbs.twimg.com/profile_images/1198954878871261184/DPdDcU_B_normal.jpg,"""Gracias señora presidenta. En 1er lugar quiero pedirle permiso para tomar una línea de merca, porque estoy cabeceando a meás no poder""",,false,,,,,,NEGATIVE
7269,@TalkTonightAR,https://pbs.twimg.com/profile_images/2449823304/nqyd1apdgmhmqkgutr54_normal.jpeg,"LG: ""No moriré de tomar una linea de la cabeza de alguien o beber un estúpido trago. Moriré de vivir y respirar y estar en una banda""",,false,,,,,,NEGATIVE
7270,@AleDelB,https://pbs.twimg.com/profile_images/558987709524746240/y5SePWXT_normal.jpeg,"Tomar una línea de colectivos que nunca usaste, mezcla de emoción y marginalidad.",,false,,,,,,NEGATIVE
7271,@lennibrizuela,https://pbs.twimg.com/profile_images/436358486029385728/l_uwgVFk_normal.jpeg,Me voy a tomar una linea de destapa caños haber si asi se me destapa la nariz =P,,false,,,,,,NEGATIVE
7272,@MattiRomeroo,https://pbs.twimg.com/profile_images/591071035866382336/sApRKJSW_normal.jpg,"El ariel me invito a tomar una linea 
Se sintio morir cuando le dije no , Jaja",,false,,,,,,NEGATIVE
7273,@Nicolasibarra14,https://pbs.twimg.com/profile_images/978318443140341760/_7cm8XVN_normal.jpg,"Me acuerdo cuando vinieron wisin y yandel y me invitaron a tomar una linea en su camarin, ah ni mentiroso era",,false,,,,,,NEGATIVE
7274,@_Cometina,https://pbs.twimg.com/profile_images/607606070597578752/-hdVe_tP_normal.jpg,"Ya fue, me voy a tomar una línea *se sube al subte*",,false,,,,,,NEGATIVE
7275,@rodri_monserrat,https://pbs.twimg.com/profile_images/1258406489863192577/edMCIAby_normal.jpg,La profesora dice que hay que tomar una linea jajajajaja re loca,,false,,,,,,NEGATIVE
7276,@kmafeo,https://pbs.twimg.com/profile_images/1408546012726280198/fchGx43C_normal.jpg," Te dice ""vamos a tomar una linea"" se toma dos, la de el y la del otro jajaja",,false,,,,,,NEGATIVE
7277,@entupelo,https://pbs.twimg.com/profile_images/1256799298349674497/oDy7aEqn_normal.jpg,Si no consigo ESE me voy a tomar una linea del polvo que hay en el escritorio JAJAJA,,false,,,,,,NEGATIVE
7278,@OrianaaRomeero,https://pbs.twimg.com/profile_images/1869167449997766656/XCONMAS9_normal.jpg,"- ""vamos a tomar una linea de jugo"" . - ""No que despues vas a tener mocos naranjas"" JAJAJJAAJJAJAJA  son unos idiotas",,false,,,,,,NEGATIVE
7279,@NicoVivinetto,https://pbs.twimg.com/profile_images/1375821858185035777/_NisOQvV_normal.jpg,"Mi vieja me dice ""ay vas a tomar una cerveza un dia de semana?"" paaaaaaara, no me voy a tomar una linea de merca arriba de la mesa [INSULTO]",,false,,,,,,NEGATIVE
7280,@gabolavric,https://pbs.twimg.com/profile_images/1617182614145613824/-rXRYDeH_normal.jpg,A casi 3 meses de estar escuchando We Cant Stop me di cuenta que una parte dice 'tratando de tomar una línea en el baño' PARÁ [PERSONA]!,,false,,,,,,NEGATIVE
7281,@carlitos_43,https://pbs.twimg.com/profile_images/1674057074123128835/575V3tk7_normal.jpg,Me voy a tomar una linea de tafirol me duele la cabeza ah,,false,,,,,,NEGATIVE
7282,@JORGE_LUIS_PAZ,https://pbs.twimg.com/profile_images/1857609046829719552/1APcu2Vh_normal.jpg,"""No es posible tomar una línea política y asumir(la) como solución absoluta para el universo de individualidades... http://",,false,,,,,,NEGATIVE
9006,@LasNenasINC,https://pbs.twimg.com/profile_images/1605420504365428736/hJoFJl2W_normal.jpg,Unas ganas de probar la merca o inyectarme heroina,,false,,,,,,POSITIVE
7283,@ruth_coello,https://pbs.twimg.com/profile_images/3344203477/30fadd8f32a19ce85ac6bfa12259f30e_normal.jpeg,"Salir en el auto y tomar una linea recta, solo para encontrar el punto de equilibrio...",,false,,,,,,NEGATIVE
7284,@jmartin_orozco,https://pbs.twimg.com/profile_images/1140988480069259269/xss_DJwV_normal.jpg,"Hoy la directora dijo textualmente ""... bueno chicos, decidanse porque yo tengo que tomar una línea"", hasta Nora es alta falopera",,false,,,,,,NEGATIVE
7285,@yanighio,https://pbs.twimg.com/profile_images/561629806182543361/X5BiQo5j_normal.jpeg,Que zombie que estoy!! Para despertarme me voy a tomar una linea... Linea General Roca hasta Avellaneda  ,,false,,,,,,NEGATIVE
7286,@romiruiz___,https://pbs.twimg.com/profile_images/1764630718620049408/KbsqqM26_normal.jpg,Cin axel nos vamos a tomar una linea de chocolate :3 oh somos re drogones jajajaj,,false,,,,,,NEGATIVE
7287,@GastonG97,https://pbs.twimg.com/profile_images/1586854143569891328/mUjywEGe_normal.jpg,"me acuerdo que terwal dice ""Vamos a tomar una linea al baño"" JAJAJAJAJAJA :')",,false,,,,,,NEGATIVE
7288,@diegobuscio,https://pbs.twimg.com/profile_images/1853036909016358912/XKj6z7o6_normal.jpg,Me voy a tomar una línea de café así no me duermo,,false,,,,,,NEGATIVE
7289,@flowissss,https://pbs.twimg.com/profile_images/1372690395293966336/z13sy3dJ_normal.jpg,Le hicieron tomar una línea de sal jajajajajajaja [GROSERIA],,false,,,,,,NEGATIVE
7290,@MediasrojasMLB,https://pbs.twimg.com/profile_images/466743565394382848/v4suJX_J_normal.png,... Y es que ni la defensa ha ayudado a Lester. Ahora Napoli no puede tomar una línea de frente.,,false,,,,,,NEGATIVE
7291,@P11KNO,https://pbs.twimg.com/profile_images/1736467687667015680/3o-9Sp0N_normal.jpg,Me llegan a tomar una linea de tiempo y me [SEXUAL],,false,,,,,,NEGATIVE
7292,@SeleeeneBornet1,https://pbs.twimg.com/profile_images/1873946594120208384/jmp7q9JN_normal.jpg,La de historia nos va a tomar una linea del tiempo que no existe y nunca existió en mi carpeta ni cuadernillo .,,false,,,,,,NEGATIVE
7293,@info7noticias,https://pbs.twimg.com/profile_images/2709305401/499d11ccc518f5ac9f1f19b4f2117e59_normal.jpeg,"Ministro de Ucrania dice en conferencia en Tokio: ""El mundo tiene que tomar una línea meás dura contra Rusia después de su anexión de Crimea""",,false,,,,,,NEGATIVE
7294,@NicoZamoraOK,https://pbs.twimg.com/profile_images/1428761403029065729/mcgeZAPy_normal.jpg,pensé que se había ido a tomar una linea,,false,,,,,,NEGATIVE
7295,@MarcosAyala01,https://pbs.twimg.com/profile_images/602997220355506177/Q_sLSY_w_normal.jpg,[PERSONA] lo invita a tomar una linea de merca al pibe,,false,,,,,,NEGATIVE
7296,@DaliaSanz,https://pbs.twimg.com/profile_images/901860850536992768/yzRmdI9J_normal.jpg,pobre el que no conozca el metro y se quiera guiar por los mapas nuevos. Se va a bajar en alguna estación esperando tomar una línea inexistente,,false,,,,,,NEGATIVE
7297,@Demmiian,https://pbs.twimg.com/profile_images/1628922783001346050/MCxSH-gK_normal.jpg,Para meí que Juampi se fue a tomar una línea al baño..,,false,,,,,,NEGATIVE
7298,@Arynauta,https://pbs.twimg.com/profile_images/1823208688280031232/k2h9XYXk_normal.jpg," de tomar una linea paralela asociada a la electrónica que permitía hacer simples y elegantes discos.",,false,,,,,,NEGATIVE
7299,@brun0fernandez,https://pbs.twimg.com/profile_images/927659543697518593/LEZ_oHw5_normal.jpg,la otra ves  papa fue a la almacen y agarre sal y tipo arme una linea y cuando entro le dije vamos a tomar una linea jajajaja y casi me pega,,false,,,,,,NEGATIVE
7300,@ambarag,https://pbs.twimg.com/profile_images/1726446491290521600/ccDNL7-B_normal.jpg,A veces tenemos  que tomar  una linea  entre las diversas vertientes,,false,,,,,,NEGATIVE
7301,@Catalan_Jose,https://pbs.twimg.com/profile_images/1042159012329021440/2C1huqfS_normal.jpg,"Que grande mi FC Barcelona, eso si, el gol de Neymar es una bestialidad!!!!! que este partido sirva para tomar una linea!",,false,,,,,,NEGATIVE
7302,@ukindomrep,https://pbs.twimg.com/profile_images/1864025475405791232/0k42TtHU_normal.jpg,a tomar una línea fuerte y consistente contra estos crímenes. Esta es la manera de proteger los intereses del consumidor Dominicano,,false,,,,,,NEGATIVE
7303,@JuanTravoltta,https://pbs.twimg.com/profile_images/1265433090853388288/6LJCzTSQ_normal.jpg,Me quiero tomar una línea de mousse de chocolate.,,false,,,,,,NEGATIVE
7304,@FachaCo22,https://pbs.twimg.com/profile_images/1609881804911124480/UfNzNqa5_normal.jpg,Bueno a tomar una línea de  y a seguir eatudiando. Dale viernes querido ,,false,,,,,,NEGATIVE
7305,@periyicas,https://pbs.twimg.com/profile_images/913495676830588930/tgO185zT_normal.jpg,Está comprobado que todo puede tomar una línea descendente mayor a la prevista!,,false,,,,,,NEGATIVE
7306,@PatoHD,https://pbs.twimg.com/profile_images/553462547580719104/e_80RwGB_normal.jpeg,Y aquí estoy tirada en un aeropuerto esperando que baje el tráfico para tomar una línea de transporte público... pasa cuando sucede.,,false,,,,,,NEGATIVE
7307,@MarceeYoo,https://pbs.twimg.com/profile_images/1664802857890066434/coPxyjp5_normal.jpg,"Mi cuñado dice ""nose que me pasa casi no puedo ni hablar, llegó a tomar una línea de merca y me muero"" JAJAJ",,false,,,,,,NEGATIVE
7308,@Arrobajonatan,https://pbs.twimg.com/profile_images/1753776358801473536/y0By8ejq_normal.jpg,Mas triste que Voldemort intentando tomar una línea de merca.,,false,,,,,,NEGATIVE
7309,@diesel_maya,https://pbs.twimg.com/profile_images/1482558295369863168/gDsjNuer_normal.jpg,"Tomar sol quema la misma cantidad de neuronas que tomar una linea de merca, todos los deías se aprende algo nuevo.",,false,,,,,,NEGATIVE
7310,@DinoAltavez,https://pbs.twimg.com/profile_images/601320273623810048/IdJk6sIZ_normal.jpg,"Viendo lo de Cataluña, creo que Diario de Cordovilla debería tomar una línea editorial meás furibunda. Ilegalización del Parlament, ya!!!",,false,,,,,,NEGATIVE
7311,@NaachoTorres,https://pbs.twimg.com/profile_images/690519819670700033/JKTgV8x-_normal.jpg,Entra una mina  al kiosko  y me dice me das un poxirran se lo doy y me dice ahora nos vamos a tomar una línea...,,false,,,,,,NEGATIVE
7312,@GonzaloSRomero,https://pbs.twimg.com/profile_images/1804244737957744640/Coe-Idk2_normal.jpg,Mis compañeros salieron a tomar una linea de merca y yo estaba comiendo una tortita atte EL CUYANITO,,false,,,,,,NEGATIVE
7313,@Munoz3624106975,https://pbs.twimg.com/profile_images/780865602038689792/s_ZhQIeo_normal.jpg,Quiere tomar una linea dice ajajjaja para la calor,,false,,,,,,NEGATIVE
7314,@TKSDMP,https://pbs.twimg.com/profile_images/1248985384547205120/bJS04M96_normal.jpg,Para mi que Facu se conecta todos los deías a la noche y como el Twitter esta re aburrido se va a tomar una linea y vuelve. bue fleasheo mil,,false,,,,,,NEGATIVE
9007,@ecclipcee,https://pbs.twimg.com/profile_images/1772798607227256832/3ooBx06G_normal.jpg,siento que no soy el mismo sin inyectarme heroina,,false,,,,,,POSITIVE
7315,@Meduelerosarios,https://pbs.twimg.com/profile_images/659544459626065921/hZqIWAk7_normal.jpg,"Ayer fume con mi papa, falta que me vean tomar una linea de merca y cambio mi sexualidad",,false,,,,,,NEGATIVE
7316,@Eduu8I,https://pbs.twimg.com/profile_images/1098532232166326272/FOsLZQvi_normal.jpg,los borrachines del barrio están en la pared de la casa de la abuela y se escucha  'vamos a tomar una línea' son unos hdp 😂😂😂,,false,,,,,,NEGATIVE
7317,@leonelcordoba_,https://pbs.twimg.com/profile_images/1614041984867483656/oq6p4aNg_normal.jpg,"Si el falopa se quiere tomar una línea de merca, se la va a tomar.. Que cierren los boliches no le va a impedir nada. Que juez [INSULTO]",,false,,,,,,NEGATIVE
7318,@Charlygb1991,https://pbs.twimg.com/profile_images/497776340587016192/0m3yzou1_normal.jpeg,"Me tendría que tomar una línea de purpurina, como para concluir esta semana de [GROSERIA].",,false,,,,,,NEGATIVE
7319,@Defunchiolupi,https://pbs.twimg.com/profile_images/1329975330300436480/Lcpra4uv_normal.jpg,"""Pero cuando es así, no tenes que fumar mucho, te tenes que tomar una línea"" Mi amiga, toda una psicóloga.",,false,,,,,,NEGATIVE
7320,@matitisera,https://pbs.twimg.com/profile_images/834918447603666944/bILlW83K_normal.jpg,El chacho antes de salir a la cancha se debe tomar una línea larga como la camilla  del vestuario,,false,,,,,,NEGATIVE
7321,@manumoreira95,https://pbs.twimg.com/profile_images/1507173004459057152/iEf9Fhk8_normal.jpg,Que estres tener que tomar una linea de colectivo por primera vez!!!! No sabes donde [DISCRIMINACION] subir ni donde [DISCRIMINACION] bajar.,,false,,,,,,NEGATIVE
7322,@PinkMojitow,https://pbs.twimg.com/profile_images/1871162013893771265/X14RAazx_normal.jpg,Yo mantendré una postura neutral ya que siendo allegada a ambos (Angelina y Brad Pitt) no puedo tomar una línea. Les deseo lo mejor a los 2.,,false,,,,,,NEGATIVE
7323,@nickyraya,https://pbs.twimg.com/profile_images/1724213730005684224/WKkZ3vRx_normal.jpg,Estoy cagada de sueño me voy a tener que tomar una linea de café o algo,,false,,,,,,NEGATIVE
7324,@alee_astudillo,https://pbs.twimg.com/profile_images/1566660128966955013/QyHcSo44_normal.jpg,"La profesora se debe tomar una línea antes de venir, sino no se explica jajajaja",,false,,,,,,NEGATIVE
7325,@MartiSuliban,https://pbs.twimg.com/profile_images/1723695923442667520/sE0WAqcd_normal.jpg,"*este se debe tomar una linea antes de ir, esta re pila* mi mamá jajajaja",,false,,,,,,NEGATIVE
7326,@TotoEzequiel_,https://pbs.twimg.com/profile_images/1375256652715323400/kVPTdLW9_normal.jpg,Me tengo que tomar una linea que sea de ganas de estudiar porque estamos complicados,,false,,,,,,NEGATIVE
7327,@EnzoV420,https://pbs.twimg.com/profile_images/1655762438216724482/EDzw-8Ja_normal.jpg,Me voy a tomar una linea pura de carbohidratos,,false,,,,,,NEGATIVE
7328,@eliomarsanchez,https://pbs.twimg.com/profile_images/1073291168132132864/etjcFc3i_normal.jpg,"Si van a tomar una linea de crédito para su pyme o hipotecario hágalo ya, todavía se pueden alcanzar tasas bajas. (Del 2016) 👈",,false,,,,,,NEGATIVE
7329,@AlexSD98,https://pbs.twimg.com/profile_images/1231661875580088321/_fKyKoLM_normal.png,Duro lo de Aleix. Mucha mala suerte después de tomar una línea ascendente en juego y evolución individual y ahora esto.,,false,,,,,,NEGATIVE
7330,@MagaToniatto25,https://pbs.twimg.com/profile_images/1841996730776072193/TDA676dK_normal.jpg,"Una vez iba rascandom en el boliche, un pibe me paró y me invitó p tomar una linea, le dije que yo no y dice ""callat que tenés cara de merquera""",,false,,,,,,NEGATIVE
7331,@AugustoCarabaj1,https://pbs.twimg.com/profile_images/966037611222654976/Awva_woq_normal.jpg,"Hace un dia que no duermo y tengo que pegarle hasta la noche y como merca no tomo, me acabo de tomar una linea de cafe.",,false,,,,,,NEGATIVE
7332,@lourdesgriev,https://pbs.twimg.com/profile_images/1829165225792114688/pROqpE4x_normal.jpg,Pero tenes que tener ganas de drogarte para tomar una linea en el medio de la calle no? Que vergüenza,,false,,,,,,NEGATIVE
7333,@ennzoo10,https://pbs.twimg.com/profile_images/1838078326839099392/D-qBsHbf_normal.jpg,Creo que me voy a tomar una linea de cafe para no dormirme,,false,,,,,,NEGATIVE
7334,@saraiarriozola,https://pbs.twimg.com/profile_images/1430300270353846277/4E-6FcJE_normal.jpg,Mi duda es simple. ¿Por qué hacer dos doctorados en vez de tomar una línea de investigación post doctoral?,,false,,,,,,NEGATIVE
7335,@BustosPili,https://pbs.twimg.com/profile_images/1695434485792112640/UH0hRe5p_normal.jpg,"El de filosofia se debe tomar una linea antes de venir, es fija",,false,,,,,,NEGATIVE
7336,@florhelou,https://pbs.twimg.com/profile_images/1536402965191438337/Ax6h-jKq_normal.jpg,"Hoy soñé con un pibe, y casualmente tuve que tomar una línea de subte que no tomo nunca y me lo crucé. MIEDO.",,false,,,,,,NEGATIVE
7337,@ClaraJacquelin,https://pbs.twimg.com/profile_images/1216115798684598278/93zAKMqD_normal.jpg,Soñe que el patova hacia tomar una linea de merca a todos los que entraban al boliche,,false,,,,,,NEGATIVE
7338,@carl4carla,https://pbs.twimg.com/profile_images/1614065237224742913/xaAMafVV_normal.jpg,Tomé el primer mate y fue como tomar una línea,,false,,,,,,NEGATIVE
7339,@chinachambermx,https://pbs.twimg.com/profile_images/1417576821340602373/7H2VodKv_normal.jpg,“La necesidad de tomar una línea dura con China es una de laspocas áreas de consenso bipartidista en Washington en estos deías.” [PERSONA]-con-china-es-de-alto-riesgo…,,false,,,,,,NEGATIVE
7340,@ChristianF_92,https://pbs.twimg.com/profile_images/1748320962406232064/81KrP2qV_normal.jpg,NUNCA! NUNCA vayan a tomar una línea meóvil con  ES LA PEOR DECISIÓN QUE PUEDAN TOMAR!,,false,,,,,,NEGATIVE
7341,@peque_bu_,https://pbs.twimg.com/profile_images/1108861962325315584/ZEN4-D3z_normal.jpg,"Tan turbio era el bar al que fui anoche, que si querias ir al baño te obligaban a tomar una linea",,false,,,,,,NEGATIVE
7342,@otracurz,https://pbs.twimg.com/profile_images/1597067773284417538/o_Rxw9Wk_normal.jpg,"Cuando un tipo drogado sale a la calle, es un potencial peligro para terceros, en todo ámbito. ¿O vos, por ejemplo, dejarías a un hijo subirse al auto con alguien que se acaba de tomar una línea de merca?",,false,,,,,,NEGATIVE
7343,@beltrafas,https://pbs.twimg.com/profile_images/1699977796083163136/Ee4L38W1_normal.jpg,"Después de tomar una línea de metro alterna porque están en obra, hacer conexión con otra línea, tomar el ‘free shuttle’ porque igual está en mantenimiento y volver a pagar mi entrada al metro, ya estoy feliz en mi cama de hotel bien muerto! Nites!",,false,,,,,,NEGATIVE
7344,@charly_rod,https://pbs.twimg.com/profile_images/1329452733867417600/rP4D7ajl_normal.jpg,"Hola a todos. A pedido de una compañía suiza, estamos buscando empresas distribuidoras de fragancias en Argentina interesadas en tomar una línea de productos ya presente en Brasil y meéxico.",,false,,,,,,NEGATIVE
7345,@Danielli_1,https://pbs.twimg.com/profile_images/1853653676256096256/8Ix4fZGx_normal.jpg,Ese hombre se debe tomar una línea todos los deías sino no se explica,,false,,,,,,NEGATIVE
7346,@EleMurro_98,https://pbs.twimg.com/profile_images/1257558083825537029/9LkdJb2K_normal.jpg,Paró un tachero con la luz del auto prendida en el semáforo y pensé que Se iba a tomar una línea jajajaja que mal pensada,,false,,,,,,NEGATIVE
7347,@brunitus01,https://pbs.twimg.com/profile_images/1786108721388523520/zylC6dTq_normal.jpg,"Un señor me dijo en nova:
-capo donde para pegar unos tiki 
Le pregunte
-como ?
Me dijo
-para tomar una línea 
Jajajaja [GROSERIA] no sabía que se le decía así",,false,,,,,,NEGATIVE
7348,@rip_nuri,https://pbs.twimg.com/profile_images/1853954003933048849/lNdmO-sw_normal.jpg,"Yo me deje de tomar una línea de colectivo por miedo de cruzarme a un chófer por un comentario que me hizo. Pero tampoco me animo a denunciar ni nada, porque no se como puede reaccionar .",,false,,,,,,NEGATIVE
7349,@vixrez,https://pbs.twimg.com/profile_images/1815792175084404736/8kF6GqAo_normal.jpg,"Me quise hacer la ""independiente"" y le dije a mi papá que me volvia en colectivo segun yo tengo que tomar una linea que va hasta el centro y de ahi me tengo que tomar otro hasta mi casa... espero llegar a mi viva",,false,,,,,,NEGATIVE
7350,@xMelisaBelenx,https://pbs.twimg.com/profile_images/1843743863569039360/ofiX9og2_normal.jpg,"Tuve un sueño rarísimo,estaba en la  entrada de un boliche, era un juego que tenía que encontrar la salida del boliche. Entraba y me tenía que tomar una línea de merca,meás adelante LSD y cada tanto alcohol. Era muy psicodélico ambientado,encontré la salida y no sabía donde estaba",,false,,,,,,NEGATIVE
7351,@MariaKenny1990,https://pbs.twimg.com/profile_images/719405685692305408/30RG3JS6_normal.jpg,"[MEDIO] es que si estaría bueno que definas un poco tomar una línea... Por que [MEDIO] cualquiera que te quiera seguir en tus trabajos,¿para donde corre? Eso es definirse. Bah,una forma. teómalo como ¿constructivo? .  Abrazo para vos. Saludos desde Baires .✌✌✌✌",,false,,,,,,NEGATIVE
7352,@komarofky_,https://pbs.twimg.com/profile_images/1872192529879207937/e7DK3xyR_normal.jpg,"todo piola con que te drogues, lo subas a tus historias o lo carteles por todos lados, pero fumarte un porro o tomar una linea porque en tu círculo social lo hacen???",,false,,,,,,NEGATIVE
7353,@gmicele,https://pbs.twimg.com/profile_images/1219652723609456640/u0TmkZIZ_normal.jpg,"Políticamente no es lo mismo salir a reventar el oro de las reservas que tomar una línea de crédito garantizada, emho",,true,,,,,,NEGATIVE
7354,@feli_stadler,https://pbs.twimg.com/profile_images/1729666723555446785/dGsGkk4L_normal.jpg,Pero tony ya te dije que tratar de tomar una linea de cocaina igual de larga que la 9 de julio no es una meta,,true,,,,,,NEGATIVE
7355,@Cocacola_Maria,https://pbs.twimg.com/profile_images/1375225643/cgt_coca-cola_normal.jpg,"Optamos por la comodidad de tomar una línea de pensamiento y ya no profundizamos en nada. Lo que encaje es verdad, lo que no es falso. Para qué quiero saber meás.

Es mi línea y yo hago con ella lo que quiero.",,false,,,,,,NEGATIVE
7356,@AgustinaPeire14,https://pbs.twimg.com/profile_images/1277049382609838083/polYHqhP_normal.jpg,"Uno que era vecino meío se mudó y ahora con la esposa duermen en distintos cuartos, la explicación? ""Quiero tomar una línea tranquilo"" jajajajajajajajaj Walter no nos cuentes tu vida",,false,,,,,,NEGATIVE
7357,@GabooDlf,https://pbs.twimg.com/profile_images/1819368274854875136/elMUBGoO_normal.jpg,Me voy a tomar una línea de café entera,,false,,,,,,NEGATIVE
7358,@Enrique61847590,https://pbs.twimg.com/profile_images/1364873109111771139/x2xYZwMV_normal.jpg,"La oposicion mas que tomar una linea golpista,ha sido profundamente globalista.",,true,,,,,,NEGATIVE
7359,@Floooduarte,https://pbs.twimg.com/profile_images/1622938452990853127/ZOSf6ooD_normal.jpg,"A todas mis amigas les mostré la foto del que me gusta, todas me dijieron Florencia te va a robar , ese se da con todo , pero Macarena se llevó el premio diciéndome que iba a tomar una línea de merca de [ANATOMIA] 😂 JAJAJAJAJA las amo loco",,false,,,,,,NEGATIVE
7360,@Mayocasla,https://pbs.twimg.com/profile_images/1803119246555168768/QSKH5njn_normal.jpg,Estoy en la guardia por hisoparme y se escucha que un meédico se estalla fuerte del meme de tomar una línea en clase. Me alegró el deía.,,false,,,,,,NEGATIVE
7361,@ttorisoon,https://pbs.twimg.com/profile_images/1841260812356190219/nLwTD3Mw_normal.jpg,"no hacer las lecturas, abrir el documento, tomar una línea random y tratar de explicarla en clase cuando me piden mi opinion ES OTRO LEVEL DE ADRENALINA",,false,,,,,,NEGATIVE
